{
  "provenance": {
    "weights_lineage": "pretrain->finetune"
  },
  "provider": "ExampleAI",
  "evaluations": [],
  "freshness_utc": "2025-10-28T03:39:04.7206114Z",
  "model_id": "example/1.0",
  "data_controls": {
    "residency": "US"
  },
  "version": "1.0.0",
  "jurisdictions_of_control": [
    "US"
  ]
}
